dataset_id,title,organization,notes,keywords,publish_date,last_update,num_resources,num_raw_files,raw_urls,portal_url,search_keyword
0d7215ca-ea1e-4ab4-a529-e203e08f29cc,"Knowledge of languages by age and gender: Canada, provinces and territories, census metropolitan areas and census agglomerations with parts",Statistics Canada | Statistique Canada,"<p>Data on the knowledge of languages, age and gender for persons in private households in occupied private dwellings for Canada, provinces and territories, census metropolitan areas and census agglomerations and parts.</p>
",,2023-11-08T20:54:40.733815,54:40.7,5,2,https://www150.statcan.gc.ca/n1/tbl/csv/98100217-fra.zip | https://www150.statcan.gc.ca/n1/tbl/csv/98100217-eng.zip,https://open.canada.ca/data/en/dataset/0d7215ca-ea1e-4ab4-a529-e203e08f29cc,ai
e7db3fb2-7f7f-45b9-a86a-ff6de00d4bc2,"Knowledge of languages by age and gender: Canada, provinces and territories, census divisions and census subdivisions",Statistics Canada | Statistique Canada,"<p>Data on the knowledge of languages, age and gender for persons in private households in occupied private dwellings for Canada, provinces and territories, census divisions and census subdivisions.
</p>
",,2023-11-08T20:54:40.076019,54:40.1,5,2,https://www150.statcan.gc.ca/n1/tbl/csv/98100216-fra.zip | https://www150.statcan.gc.ca/n1/tbl/csv/98100216-eng.zip,https://open.canada.ca/data/en/dataset/e7db3fb2-7f7f-45b9-a86a-ff6de00d4bc2,ai
fca6437f-c511-4406-bd9f-ac8d879dbb7f,"Mother tongue by knowledge of official languages for children in couple families: Canada, provinces and territories and census metropolitan areas with parts",Statistics Canada | Statistique Canada,"Data on mother tongue of married spouse or common-law partner by mother tongue of child, mother tongue of other married spouse or common-law partner, knowledge of official languages by married spouse or common law partner, knowledge of official language by child, knowledge of official languages by other married spouse or common-law partner and age of child for children under 18 years of age in couple families in private households.",,2023-11-08T20:54:36.626782,54:36.6,5,2,https://www150.statcan.gc.ca/n1/tbl/csv/98100211-fra.zip | https://www150.statcan.gc.ca/n1/tbl/csv/98100211-eng.zip,https://open.canada.ca/data/en/dataset/fca6437f-c511-4406-bd9f-ac8d879dbb7f,ai
14273f43-e89b-4008-986b-d333adf83c5b,"First official language spoken by income statistics, age and gender: Canada, provinces and territories, census metropolitan areas and census agglomerations with parts",Statistics Canada | Statistique Canada,"Data on the first official language spoken by some income statistics, age and gender for the population ages 15 years and over excluding institutional residents.
",,2023-11-08T20:54:31.254919,54:31.3,5,2,https://www150.statcan.gc.ca/n1/tbl/csv/98100203-fra.zip | https://www150.statcan.gc.ca/n1/tbl/csv/98100203-eng.zip,https://open.canada.ca/data/en/dataset/14273f43-e89b-4008-986b-d333adf83c5b,ai
91cd28a6-2e6c-410a-966e-4fe9c48fbb04,"Knowledge of official languages by income statistics, age and gender: Canada, provinces and territories, census metropolitan areas and census agglomerations with parts",Statistics Canada | Statistique Canada,"Data on the knowledge of official languages by some income statistics, age and gender for the population ages 15 years and over excluding institutional residents.",,2023-11-08T20:54:30.582374,54:30.6,5,2,https://www150.statcan.gc.ca/n1/tbl/csv/98100202-fra.zip | https://www150.statcan.gc.ca/n1/tbl/csv/98100202-eng.zip,https://open.canada.ca/data/en/dataset/91cd28a6-2e6c-410a-966e-4fe9c48fbb04,ai
274da97f-cea1-4719-8264-3c1ac951f81f,"First official language spoken by language spoken most often at home, other language(s) spoken regularly at home, and knowledge of official languages: Canada, provinces and territories, census divisions and census subdivisions",Statistics Canada | Statistique Canada,"Data on first official language spoken, language spoken most often at home, other language(s) spoken regularly at home, knowledge of official languages and age for the population excluding institutional residents.",,2023-11-08T20:54:24.808348,54:24.8,5,2,https://www150.statcan.gc.ca/n1/tbl/csv/98100191-fra.zip | https://www150.statcan.gc.ca/n1/tbl/csv/98100191-eng.zip,https://open.canada.ca/data/en/dataset/274da97f-cea1-4719-8264-3c1ac951f81f,ai
48f5f148-8b3f-431d-86c2-5b4e1f50f2ba,"Mother tongue by language spoken most often at home, other language(s) spoken regularly at home and knowledge of official languages: Canada, provinces and territories, census divisions and census subdivisions",Statistics Canada | Statistique Canada,"Data on mother tongue, language spoken most often at home, other language(s) spoken regularly at home, knowledge of official languages and age for the population excluding institutional residents.",,2023-11-08T20:54:21.805410,54:21.8,5,2,https://www150.statcan.gc.ca/n1/tbl/csv/98100184-fra.zip | https://www150.statcan.gc.ca/n1/tbl/csv/98100184-eng.zip,https://open.canada.ca/data/en/dataset/48f5f148-8b3f-431d-86c2-5b4e1f50f2ba,ai
7b3eea55-9c23-4747-a064-088bb667fe09,"Mother tongue by language spoken most often at home, other language(s) spoken regularly at home, knowledge of official languages and first official language spoken: Canada, provinces and territories, census metropolitan areas and census agglomerations with parts",Statistics Canada | Statistique Canada,"Data on mother tongue, language spoken most often at home, other language(s) spoken regularly at home, knowledge of official languages, first official language spoken, age and gender for the population excluding institutional residents.
",,2023-11-08T20:54:21.112871,54:21.1,5,2,https://www150.statcan.gc.ca/n1/tbl/csv/98100183-fra.zip | https://www150.statcan.gc.ca/n1/tbl/csv/98100183-eng.zip,https://open.canada.ca/data/en/dataset/7b3eea55-9c23-4747-a064-088bb667fe09,ai
1cbdb4e7-3113-416a-97be-ceaf04c41882,"Mother tongue by knowledge of official languages: Canada, provinces and territories and federal electoral districts (2013 Representation Order)",Statistics Canada | Statistique Canada,"Data on mother tongue, knowledge of official languages, gender and age for the population excluding institutional residents for Canada, provinces and territories and federal electoral districts.
",,2023-11-08T20:54:18.448139,54:18.4,5,2,https://www150.statcan.gc.ca/n1/tbl/csv/98100179-fra.zip | https://www150.statcan.gc.ca/n1/tbl/csv/98100179-eng.zip,https://open.canada.ca/data/en/dataset/1cbdb4e7-3113-416a-97be-ceaf04c41882,ai
ee9542f3-39c7-4300-b505-29da50f9af9d,"Mother tongue by knowledge of official languages: Canada, provinces and territories and economic regions",Statistics Canada | Statistique Canada,"Data on mother tongue, knowledge of official languages, gender and age for the population excluding institutional residents for Canada, provinces, territories and economic regions.",,2023-11-08T20:54:17.771399,54:17.8,5,2,https://www150.statcan.gc.ca/n1/tbl/csv/98100178-fra.zip | https://www150.statcan.gc.ca/n1/tbl/csv/98100178-eng.zip,https://open.canada.ca/data/en/dataset/ee9542f3-39c7-4300-b505-29da50f9af9d,ai
9b7cc152-2fdb-49f8-b211-5b8ecfdd7365,"Mother tongue by knowledge of official languages: Census metropolitan areas, tracted census agglomerations and census tracts",Statistics Canada | Statistique Canada,"Data on mother tongue, knowledge of official languages, gender and age for the population excluding institutional residents for census metropolitan areas, tracted census agglomerations and census tracts.",,2023-11-08T20:54:17.043665,54:17.0,5,2,https://www150.statcan.gc.ca/n1/tbl/csv/98100176-fra.zip | https://www150.statcan.gc.ca/n1/tbl/csv/98100176-eng.zip,https://open.canada.ca/data/en/dataset/9b7cc152-2fdb-49f8-b211-5b8ecfdd7365,ai
90aa531a-7652-4121-8e54-8d1085dff5fc,"Mother tongue by knowledge of official languages: Canada, provinces and territories, census metropolitan areas and census agglomerations with parts",Statistics Canada | Statistique Canada,"Data on mother tongue, knowledge of official languages, gender and age for the population excluding institutional residents for Canada, provinces and territories, census metropolitan areas and census agglomerations.",,2023-11-08T20:54:15.973557,54:16.0,5,2,https://www150.statcan.gc.ca/n1/tbl/csv/98100175-fra.zip | https://www150.statcan.gc.ca/n1/tbl/csv/98100175-eng.zip,https://open.canada.ca/data/en/dataset/90aa531a-7652-4121-8e54-8d1085dff5fc,ai
57812a5f-e1b7-4857-b348-d53c44c8c9fa,"Mother tongue by knowledge of official languages: Canada, provinces and territories, census divisions, census subdivisions and dissemination areas",Statistics Canada | Statistique Canada,"Data on mother tongue, knowledge of official languages and gender for the population excluding institutional residents for Canada, provinces and territories, census divisions, census subdivisions and dissemination areas.",,2023-11-08T20:54:15.316538,54:15.3,5,2,https://www150.statcan.gc.ca/n1/tbl/csv/98100174-fra.zip | https://www150.statcan.gc.ca/n1/tbl/csv/98100174-eng.zip,https://open.canada.ca/data/en/dataset/57812a5f-e1b7-4857-b348-d53c44c8c9fa,ai
6cd36005-f7e4-4fe5-a21b-e56e70074760,"Mother tongue by knowledge of official languages: Canada, provinces and territories, census divisions and census subdivisions",Statistics Canada | Statistique Canada,"Data on mother tongue, knowledge of official languages, gender and age for the population excluding institutional residents for Canada, provinces and territories, census divisions and census subdivisions.",,2023-11-08T20:54:14.649019,54:14.6,5,2,https://www150.statcan.gc.ca/n1/tbl/csv/98100173-fra.zip | https://www150.statcan.gc.ca/n1/tbl/csv/98100173-eng.zip,https://open.canada.ca/data/en/dataset/6cd36005-f7e4-4fe5-a21b-e56e70074760,ai
69e0cbf2-457f-4313-8013-9252e722d5b8,"Mother tongue by knowledge of official languages, language spoken most often at home and other language(s) spoken regularly at home: Canada, provinces and territories, census divisions and census subdivisions",Statistics Canada | Statistique Canada,"Data on mother tongue, knowledge of official languages, language spoken most often at home and other language(s) spoken regularly at home and age for the population excluding institutional residents.",,2023-11-08T20:54:13.778128,54:13.8,5,2,https://www150.statcan.gc.ca/n1/tbl/csv/98100172-fra.zip | https://www150.statcan.gc.ca/n1/tbl/csv/98100172-eng.zip,https://open.canada.ca/data/en/dataset/69e0cbf2-457f-4313-8013-9252e722d5b8,ai
f98a16b1-8914-414e-9945-95331e0b2b11,"Mother tongue by knowledge of official languages, language spoken most often at home and other language(s) spoken regularly at home: Canada, provinces and territories, census metropolitan areas and census agglomerations with parts",Statistics Canada | Statistique Canada,"Data on mother tongue, knowledge of official languages, language spoken most often at home and other language(s) spoken regularly at home, age and gender for the population excluding institutional residents.
",,2023-11-08T20:54:12.938266,54:12.9,5,2,https://www150.statcan.gc.ca/n1/tbl/csv/98100171-fra.zip | https://www150.statcan.gc.ca/n1/tbl/csv/98100171-eng.zip,https://open.canada.ca/data/en/dataset/f98a16b1-8914-414e-9945-95331e0b2b11,ai
08fe2f19-f74a-49df-8204-44ca7d7e714b,"Mother tongue by first official language spoken and knowledge of official languages: Canada, provinces and territories, census divisions and census subdivisions",Statistics Canada | Statistique Canada,"Data on mother tongue, first official language spoken, knowledge of official languages, age and gender for the population excluding institutional residents.",,2023-11-08T20:54:11.973045,54:12.0,5,2,https://www150.statcan.gc.ca/n1/tbl/csv/98100170-fra.zip | https://www150.statcan.gc.ca/n1/tbl/csv/98100170-eng.zip,https://open.canada.ca/data/en/dataset/08fe2f19-f74a-49df-8204-44ca7d7e714b,ai
7915c767-3088-4398-bb24-6f9b3d7ba630,"Percentage of employees required to be bilingual in English and French, third quarter of 2022",Statistics Canada | Statistique Canada,"<p>Percentage of employees required to be bilingual in English and French, by North American Industry Classification System (NAICS), business employment size, type of business, business activity and majority ownership, third quarter of 2022.<br>
</p>
",,2023-11-08T20:53:48.522908,53:48.5,5,2,https://www150.statcan.gc.ca/n1/tbl/csv/33100550-fra.zip | https://www150.statcan.gc.ca/n1/tbl/csv/33100550-eng.zip,https://open.canada.ca/data/en/dataset/7915c767-3088-4398-bb24-6f9b3d7ba630,ai
13b4689c-2f9b-4f28-be38-e85e76910efb,Notice of Amendment: Prescription Drug List (PDL): Epinephrine (topical solution),Health Canada | Santé Canada,The purpose of this Notice of Amendment is to notify that Health Canada will add Epinephrine topical solution for hemostasis when sold at a concentration equal to or greater than 1 mg/ml (1:1000) to the Prescription Drug List (PDL). Both the Human and the Veterinary parts of the PDL were revised.,,2023-10-27T19:12:04.467787,00:48.0,2,0,,https://open.canada.ca/data/en/dataset/13b4689c-2f9b-4f28-be38-e85e76910efb,ml
e1fc5a33-1b1e-433d-977a-462f98c83ae3,"Percentage of employees required to be bilingual in English and French, third quarter of 2023",Statistics Canada | Statistique Canada,"Percentage and average percentage of employees required to be bilingual in English and French, by North American Industry Classification System (NAICS), business employment size, type of business, business activity and majority ownership, third quarter of 2023.<br>",,2023-09-18T14:24:34.614049,24:34.6,5,2,https://www150.statcan.gc.ca/n1/tbl/csv/33100706-fra.zip | https://www150.statcan.gc.ca/n1/tbl/csv/33100706-eng.zip,https://open.canada.ca/data/en/dataset/e1fc5a33-1b1e-433d-977a-462f98c83ae3,ai
6768e038-ae14-4c21-beff-8bf3e21b38b5,Priority Review of Drug Submissions Policy,Health Canada | Santé Canada,"Administrative Corrections to Health Canada's Priority Review Documents. Administrative changes were made to the French and Englishs version of the following Health Canada documents:
1/ Policy: Priority Review of Drug Submissions / Politique : Évaluation prioritaire des présentations de drogues.
2/ Guidance for Industry: Priority Review of Drug Submissions / Ligne directrice à l'intention de l'industrie: Évaluation prioritaire des présentations de drogues",,2023-09-01T13:12:06.033514,00:49.9,2,0,,https://open.canada.ca/data/en/dataset/6768e038-ae14-4c21-beff-8bf3e21b38b5,ai
ccaef053-36ec-4b37-adc1-7eff961a9012,"Adoption of advanced business intelligence technologies, by industry and enterprise size",Statistics Canada | Statistique Canada,"Survey of advanced technology, adoption of advanced business intelligence technologies, by type of advanced technologies, North American Industry Classification System (NAICS) and enterprise size for Canada and certain provinces, in 2022.  <br>",,2023-07-28T12:35:31.630962,35:31.6,5,2,https://www150.statcan.gc.ca/n1/tbl/csv/27100389-fra.zip | https://www150.statcan.gc.ca/n1/tbl/csv/27100389-eng.zip,https://open.canada.ca/data/en/dataset/ccaef053-36ec-4b37-adc1-7eff961a9012,business intelligence
df106e11-4cee-425d-bd38-7e51ac674128,Flood Susceptibility Index (FSI),Natural Resources Canada | Ressources naturelles Canada,"This national map of flood susceptibility or flood prone areas is based on patterns of historic flood events as predicted by an ensemble machine learning model.  
  
  The recommended use is national, provincial or regional scale and can be used as a guide for identifying areas for further investigation. The Flood Susceptibility Index (FSI) Dataset, while processed and available at 30m cell size, is not recommended for use at the pixel or street level, given the uncertainty in the modelling proc",,2022-09-27T14:45:11.832936,40:43.7,12,0,,https://open.canada.ca/data/en/dataset/df106e11-4cee-425d-bd38-7e51ac674128,machine learning
6d824264-651a-4c01-948f-5820d09ffe7c,Ombuds Annual Report—September 2019 to August 2020,Office of the Auditor General of Canada | Bureau du vérificateur général du Canada,"This report shares information on the Ombuds function, provides a snapshot of what I’ve heard to date, and offers a few general observations on well-being at the OAG. I see the report as an awareness tool and a feedback mechanism. I hope it will contribute to the conversation about how we can all work together to create a healthy and productive workplace.
",,2023-07-12T12:03:09.563350,03:09.6,2,0,,https://open.canada.ca/data/en/dataset/6d824264-651a-4c01-948f-5820d09ffe7c,ai
8c773994-1031-411b-a1ad-933928daa4ac,Northern Resident Killer Whale Group Cohesion (1980-2010),Fisheries and Oceans Canada | Pêches et Océans Canada,"Data from: Stredulinsky et al. (2021) Family feud: permanent group splitting in a highly philopatric mammal, the killer whale (Orcinus orca). Behavioural Ecology and Sociobiology. https://link.springer.com/article/10.1007/s00265-021-02992-8.

Group cohesion and demographic parameters were derived from annual censuses of Northern Resident Killer Whales (NRKW) in Pacific Canadian coastal waters, conducted by DFO's Cetacean Research Program since 1973.

For animals that tend to remain with their na",,2021-02-12T19:23:07.912609,33:16.6,6,4,https://api-proxy.edh.azure.cloud.dfo-mpo.gc.ca/catalogue/records/8c773994-1031-411b-a1ad-933928daa4ac/attachments/stredulinsky-et-al.-2021-group-cohesion-modelling-dataframe_en.csv | https://api-proxy.edh.azure.cloud.dfo-mpo.gc.ca/catalogue/records/8c773994-1031-411b-a1ad-933928daa4ac/attachments/stredulinsky-et-al.-2021-group-cohesion-modelling-dataframe_fr.csv | https://api-proxy.edh.azure.cloud.dfo-mpo.gc.ca/catalogue/records/8c773994-1031-411b-a1ad-933928daa4ac/attachments/stredulinsky-et-al.-2021-predictor-statistics_en.csv | https://api-proxy.edh.azure.cloud.dfo-mpo.gc.ca/catalogue/records/8c773994-1031-411b-a1ad-933928daa4ac/attachments/stredulinsky-et-al.-2021-predictor-statistics_fr.csv,https://open.canada.ca/data/en/dataset/8c773994-1031-411b-a1ad-933928daa4ac,machine learning
4676b124-af8a-4368-a223-f54bd57d24ae,"Knowledge of official languages by income statistics, highest level of education, immigrant status and period of immigration and work activity during the reference year: Canada, provinces and territories, census metropolitan areas and census agglomerations with parts",Statistics Canada | Statistique Canada,"Data on knowledge of official languages by income statistics, highest certificate, diploma or degree, immigrant status and period of immigration, work activity during the reference year, age and gender for the population aged 15 years and over in private households in Canada, provinces and territories, census metropolitan areas and census agglomerations with parts.",,2023-06-21T12:36:48.934908,36:48.9,5,2,https://www150.statcan.gc.ca/n1/tbl/csv/98100365-fra.zip | https://www150.statcan.gc.ca/n1/tbl/csv/98100365-eng.zip,https://open.canada.ca/data/en/dataset/4676b124-af8a-4368-a223-f54bd57d24ae,ai
95a14e9f-84f8-416f-9791-f430e61e73da,"Standing Committee on Science and Research (SRSR) - February 2, 2023",National Research Council Canada | Conseil national de recherches Canada,Study of Research and Scientific Publication in French and International Moonshot Programs – Briefing material for National Research Council Canada President Iain Stewart.,,2023-06-07T21:02:31.924833,02:31.9,2,0,,https://open.canada.ca/data/en/dataset/95a14e9f-84f8-416f-9791-f430e61e73da,ai
3b31158e-6605-4f3b-8684-3b1a0d754320,Legistics,Department of Justice Canada | Ministère de la Justice Canada,"Legistics is a collection of terms commonly used in legislative decisions or legal documents. It is meant to provide meaning to terms used including notwithstanding, Gender-neutral language and others. Occasionally, due to the nature of a resource, it can only be made available in one of the two official languages. This particular resource has been made available in English only. ",,2019-11-06T15:39:24.587902,25:53.3,2,0,,https://open.canada.ca/data/en/dataset/3b31158e-6605-4f3b-8684-3b1a0d754320,ai
c1d78a56-6f84-4bc5-98d9-fde3082c46f6,"Charter Statement - Bill C-13: An Act to amend the Official Languages Act, to enact the Use of French in Federally Regulated Private Businesses Act and to make related amendments to other Acts",Department of Justice Canada | Ministère de la Justice Canada,"Section 4.2 of the Department of Justice Act requires the Minister of Justice to prepare a “Charter Statement” for every government bill to help inform public and Parliamentary debate on government bills. One of the Minister of Justice’s most important responsibilities is to examine legislation for inconsistency with the Canadian Charter of Rights and Freedoms [“the Charter”]. By tabling a Charter Statement, the Minister is sharing some of the key considerations that informed the review of a bil",,2022-07-12T20:13:08.484419,25:38.0,2,0,,https://open.canada.ca/data/en/dataset/c1d78a56-6f84-4bc5-98d9-fde3082c46f6,ai
6b8ae3f4-be73-45a9-85e4-827bdd90d33d,"JustFacts: Family Disputes and the Canadian Legal Problems Survey, 2021",Department of Justice Canada | Ministère de la Justice Canada,"This fact sheet is based on data from the 2021 Canadian Legal Problems Survey (CLPS) undertaken by Statistics Canada and commissioned by Justice Canada. The CLPS is a legal needs or legal problems survey; these surveys are done in countries around the world to measure the incidence of legal problems, how respondents attempt to resolve them, and the impacts of these problems. The CLPS reached people aged 18 years and older who could speak English or French. The final sample size was 21,170 people",,2023-02-13T19:24:15.329754,24:52.4,6,0,,https://open.canada.ca/data/en/dataset/6b8ae3f4-be73-45a9-85e4-827bdd90d33d,ai
cdc11e49-caac-442c-88c9-d32b071b4b9c,Hate as an Aggravating Factor at Sentencing. A Review of the Case Law from 2007–2020,Department of Justice Canada | Ministère de la Justice Canada,"This study examines the way courts have applied hate as an aggravating factor at sentencing (subparagraph 718.2(a)(i) of the Criminal Code). The main purpose of this research was to identify the most common characteristics of offenders and victims of hate crimes, to identify the most frequent grounds of victimization, the reasoning behind the courts’ application of subparagraph 718.2(a)(i) of the Criminal Code, and to find trends in the way sentencing judges determine the quantum of sentences af",,2023-02-01T16:19:16.139091,24:48.5,4,0,,https://open.canada.ca/data/en/dataset/cdc11e49-caac-442c-88c9-d32b071b4b9c,ai
aad15cf1-c25e-40a3-aeea-68a7ff87b04e,"Languages used at work by occupation and knowledge of official languages: Canada, provinces and territories and census metropolitan areas with parts",Statistics Canada | Statistique Canada,"Data on language used most often at work by other language(s) used regularly at work, occupation - unit group - National Occupational Classification (NOC) 2021, knowledge of official languages and labour force status for the population aged 15 years and over who worked since 2020, in private households of Canada, provinces and territories and census metropolitan areas with parts.",,2023-03-29T12:36:42.046137,36:42.0,5,2,https://www150.statcan.gc.ca/n1/tbl/csv/98100532-fra.zip | https://www150.statcan.gc.ca/n1/tbl/csv/98100532-eng.zip,https://open.canada.ca/data/en/dataset/aad15cf1-c25e-40a3-aeea-68a7ff87b04e,ai
9988ccfc-a9bb-4400-abea-7324dfee1edf,"Languages used at work by industry groups and knowledge of official languages: Canada, provinces and territories, census metropolitan areas and census agglomerations with parts",Statistics Canada | Statistique Canada,"Data on language used most often at work by other language(s) used regularly at work, industry groups - North American Industry Classification System (NAICS) 2017, knowledge of official languages and labour force status for the population aged 15 years and over who worked since 2020, in private households of Canada, provinces and territories, census metropolitan areas and census agglomerations with parts.",,2023-03-29T12:36:39.851124,36:39.9,5,2,https://www150.statcan.gc.ca/n1/tbl/csv/98100531-fra.zip | https://www150.statcan.gc.ca/n1/tbl/csv/98100531-eng.zip,https://open.canada.ca/data/en/dataset/9988ccfc-a9bb-4400-abea-7324dfee1edf,ai
9af5ee1e-e1ac-43bb-8ae1-be831f657cfe,Mother tongue by knowledge of official languages: Canada and forward sortation areas ©,Statistics Canada | Statistique Canada,"Data on mother tongue, knowledge of official languages, gender and age for the population excluding institutional residents for Canada and forward sortation areas.",,2023-03-29T12:36:02.010361,36:02.0,5,2,https://www150.statcan.gc.ca/n1/tbl/csv/98100177-fra.zip | https://www150.statcan.gc.ca/n1/tbl/csv/98100177-eng.zip,https://open.canada.ca/data/en/dataset/9af5ee1e-e1ac-43bb-8ae1-be831f657cfe,ai
