dataset_id,title,organization,notes,keywords,publish_date,last_update,num_resources,num_raw_files,raw_urls,portal_url,search_keyword
850cef37-ea1d-406c-b2be-8ae2984fb531,"Counts of harbour seals (Phoca vitulina) and grey seals (Halichoerus grypus) from an aerial survey of the coast of the Newfoundland Shelf and Sandwich Bay, Labrador during the summer of 2021",Fisheries and Oceans Canada | Pêches et Océans Canada,"Harbour seals reside throughout the year around Newfoundland and Labrador (NL). The first systematic survey for harbour seals occurred along the NL Shelf during July and August 2021 to obtain counts of hauled out individuals and assess distribution. Grey seals are seasonal residents in NL, mainly present in the summer and autumn months. Grey seals were also recorded during the survey as these two species can share haul-out locations. Surveys were flown along the coastline with a Bell 429 helicop",,2024-12-05T14:20:36.494969,22:51.1,5,2,https://api-proxy.edh.azure.cloud.dfo-mpo.gc.ca/catalogue/records/850cef37-ea1d-406c-b2be-8ae2984fb531/attachments/DataDictionary-DictionnaireDonn%C3%A9es.csv | https://api-proxy.edh.azure.cloud.dfo-mpo.gc.ca/catalogue/records/850cef37-ea1d-406c-b2be-8ae2984fb531/attachments/Harbour%20Seal%202021%20Survey-Relev%C3%A9%20des%20phoques%20communs%202021.csv,https://open.canada.ca/data/en/dataset/850cef37-ea1d-406c-b2be-8ae2984fb531,ai
7d41de48-ec57-476b-9817-84167774c7c5,"Modelling the dispersion of infectious salmon anemia virus from Atlantic salmon farms in the Quoddy Region of New Brunswick, Canada and Maine, USA",Fisheries and Oceans Canada | Pêches et Océans Canada,Pathogen dispersal from infected aquaculture sites into the surrounding ocean poses risks of infection to wild and farmed species but is difficult to predict. This study aimed to build a framework using an ocean circulation and a particle tracking model in conjunction with a dynamic infection model and a virus inactivation model to simulate the dispersal of the infectious salmon anemia virus (ISAV) from Atlantic salmon farms. Simulated particles were released from hypothetically infected farms a,,2024-12-05T14:40:29.289808,40:29.3,1,0,,https://open.canada.ca/data/en/dataset/7d41de48-ec57-476b-9817-84167774c7c5,ai
046e01e0-8f38-44c3-a541-e868b7761915,Project Returns for Wetland Inventory Pilots,Government of Alberta | Gouvernement de l'Alberta,"The Wetland Inventory Pilot project is part of ongoing efforts to develop innovative wetland mapping methodologies across Alberta, Canada with the objective to refine and establish wetland inventory mapping methodologies using advanced Earth Observation (EO) imagery and machine learning (ML) techniques. Wetland Inventory was developed for four pilot study areas within Alberta for the Boreal 1: South Hay-Zama Lake (7,613 km2), Boreal 2: North Slave Lake (21,215 km2), Grassland located east of Bro",,2024-12-04T19:31:57.530554,31:57.5,5,0,,https://open.canada.ca/data/en/dataset/046e01e0-8f38-44c3-a541-e868b7761915,ml
046e01e0-8f38-44c3-a541-e868b7761915,Project Returns for Wetland Inventory Pilots,Government of Alberta | Gouvernement de l'Alberta,"The Wetland Inventory Pilot project is part of ongoing efforts to develop innovative wetland mapping methodologies across Alberta, Canada with the objective to refine and establish wetland inventory mapping methodologies using advanced Earth Observation (EO) imagery and machine learning (ML) techniques. Wetland Inventory was developed for four pilot study areas within Alberta for the Boreal 1: South Hay-Zama Lake (7,613 km2), Boreal 2: North Slave Lake (21,215 km2), Grassland located east of Bro",,2024-12-04T19:31:57.530554,31:57.5,5,0,,https://open.canada.ca/data/en/dataset/046e01e0-8f38-44c3-a541-e868b7761915,machine learning
cea9985f-5e0f-425e-9b7e-e1d122272c56,Algorithmic Impact Assessment - ATIP Online Request Service,Treasury Board of Canada Secretariat | Secrétariat du Conseil du Trésor du Canada,"Detailed results from the Algorithmic Impact Assessment for the [ATIP Online Request Service.](https://atip-aiprp.tbs-sct.gc.ca/en/Home/Welcome)

What is the Algorithmic Impact Assessment?
The AIA is a questionnaire designed to help users assess and mitigate the risks associated with deploying an automated decision system. The AIA also helps identify the impact level of the automated decision system under the proposed Directive on Automated Decision-Making. The questions are focused on busine",,2020-01-31T13:21:33.790670,42:05.6,12,6,https://open.canada.ca/data/dataset/cea9985f-5e0f-425e-9b7e-e1d122272c56/resource/aa0e96d8-0432-4398-948d-6d52cb5f0472/download/en-data-dictionary-aia-aors.csv | https://open.canada.ca/data/dataset/cea9985f-5e0f-425e-9b7e-e1d122272c56/resource/ad75051c-c35a-42c4-b773-de170bb2bdc5/download/fr-data-dictionary-aia-aors.csv | https://open.canada.ca/data/dataset/cea9985f-5e0f-425e-9b7e-e1d122272c56/resource/51b5378f-1f1d-4a20-a7c8-4f313ae6c617/download/aors-aia-1.csv | https://open.canada.ca/data/dataset/cea9985f-5e0f-425e-9b7e-e1d122272c56/resource/5678a163-bfaa-4006-b655-75c5fe421d58/download/atip-digital-services-aia.json | https://open.canada.ca/data/dataset/cea9985f-5e0f-425e-9b7e-e1d122272c56/resource/612bf087-68b3-4358-bff6-6e49746c89ec/download/atip-digital-services-aia.json | https://open.canada.ca/data/dataset/cea9985f-5e0f-425e-9b7e-e1d122272c56/resource/1c69df96-52ac-4226-b144-a16d8fb20526/download/atip-digital-services-aia.json,https://open.canada.ca/data/en/dataset/cea9985f-5e0f-425e-9b7e-e1d122272c56,ai
52b8574d-5c95-463b-b375-8edd092cea30,Using artificial intelligence (AI) to automate candidate evaluations in the staffing process's assessment phase,Treasury Board of Canada Secretariat | Secrétariat du Conseil du Trésor du Canada,"Detailed results from the Algorithmic Impact Assessment (AIA) for the Knockri pilot project. 

The goal of the proposed pilot project is to reduce the time and cost associated with conducting interviews, resolve potential issues with rater bias, and maintain a high degree of structure and rigor in the interview process. Providing all candidates with equal opportunity for employment within the Canadian government.",,2024-02-28T14:51:05.445341,33:07.5,3,1,https://open.canada.ca/data/dataset/52b8574d-5c95-463b-b375-8edd092cea30/resource/4baa87d0-0123-4d51-8de9-271607dd060f/download/algorithmic-impact-assessment-using-artificial-intelligence-ai-to-automate-candidate-evaluation.json,https://open.canada.ca/data/en/dataset/52b8574d-5c95-463b-b375-8edd092cea30,ai
57121990-0991-4aee-9674-9d5ac72fdfc4,Departmental Results Framework Indicators 2022-2023 Edition - Indicator 7: Service Satisfaction Index,Canada Revenue Agency | Agence du revenu du Canada,"The Service Satisfaction Index is calculated from the results of the questions:
The CRA’s service was easy to access + The CRA’s service was timely + The information I was given was accurate + The information I was given was complete + The information I was given was easy to understand + The CRA representative took time to understand my situation + The CRA representative was professional + The CRA representative was courteous.

It is an average of scores from the three audiences (individuals,",,2024-01-24T15:21:06.120139,17:07.7,2,2,https://open.canada.ca/data/dataset/57121990-0991-4aee-9674-9d5ac72fdfc4/resource/5030f36d-aad3-4320-b2b4-16510691ce22/download/drf-ind7-2022-2023-eng.csv | https://open.canada.ca/data/dataset/57121990-0991-4aee-9674-9d5ac72fdfc4/resource/03781ab9-2b19-4d15-8903-3bd439248886/download/cmr-ind7-2022-2023-fra.csv,https://open.canada.ca/data/en/dataset/57121990-0991-4aee-9674-9d5ac72fdfc4,ai
975c3b30-afaf-481f-a3b8-cfa353a4c70f,2022-2023 Annual Report on the Administration of the Access to Information Act,Canadian Air Transport Security Authority | Administration canadienne de la sûreté du transport aérien,This Annual Report on the Canadian Air Transport Security Authority’s (CATSA) administration of the Act has been prepared in accordance with Section 94(1) and is hereby submitted for tabling in Parliament under Section 94(2) of the Act.,,2024-04-19T21:13:13.085024,09:11.9,2,0,,https://open.canada.ca/data/en/dataset/975c3b30-afaf-481f-a3b8-cfa353a4c70f,ai
6b429c8e-ee5b-451a-883f-b6180ada9286,Algorithmic Impact Assessment - Employment Insurance Machine Learning Workload,Employment and Social Development Canada | Emploi et Développement social Canada,"## EI Machine Learning Workload: Achieving Workload Reduction in Employment Insurance Recalculation Processes
  
Recalculation within the context of Employment Insurance (EI) typically occurs when changes in circumstances or new information emerge that could impact the accuracy of benefit calculations. 
Recalculation falls under a specialized category of EI claims aimed at correcting previously determined benefits.

 During the recalculation process, the program implements specific measures",,2024-04-16T14:11:38.003395,06:25.8,3,1,https://open.canada.ca/data/dataset/6b429c8e-ee5b-451a-883f-b6180ada9286/resource/19182fb2-ae7a-4775-a7c7-7b8c010d84b9/download/aia-results_json.json,https://open.canada.ca/data/en/dataset/6b429c8e-ee5b-451a-883f-b6180ada9286,machine learning
a5b85131-9e48-41b5-a9d7-e07be82ee4f0,THE FEDERAL BRIDGE CORPORATION LIMITED 2022-23 ANNUAL REPORT TO PARLIAMENT ON THE ACCESS TO INFORMATION ACT,Federal Bridge Corporation | Société des ponts fédéraux,THE FEDERAL BRIDGE CORPORATION LIMITED 2022-23 ANNUAL REPORT TO PARLIAMENT ON THE ACCESS TO INFORMATION ACT,,2023-11-06T21:41:27.915900,17:37.2,2,0,,https://open.canada.ca/data/en/dataset/a5b85131-9e48-41b5-a9d7-e07be82ee4f0,ai
2e34163f-f74e-4876-9a84-20c92966af82,"THE SEAWAY INTERNATIONAL BRIDGE CORPORATION, LTD. 2022-23 ANNUAL REPORT TO PARLIAMENT ON THE ACCESS TO INFORMATION ACT","The Seaway International Bridge Corporation | Corporation du pont international de la voie maritime, Ltée","THE SEAWAY INTERNATIONAL BRIDGE CORPORATION, LTD.
2022-23 ANNUAL REPORT TO PARLIAMENT ON
THE ACCESS TO INFORMATION ACT",,2023-11-07T14:31:35.434313,17:34.7,2,0,,https://open.canada.ca/data/en/dataset/2e34163f-f74e-4876-9a84-20c92966af82,ai
24d2cab2-6a0d-4234-9239-b6ce102ebabd,Reducing Employment Insurance Backlog: A Machine Learning Approach,Employment and Social Development Canada | Emploi et Développement social Canada,"UPDATE: 

In July 2023, the implementation of the Machine Learning model proved successful, resulting in the completion of over 40,000 claims.
Although this page won't receive further updates, the project is still ongoing and can be accessed [here](https://open.canada.ca/data/en/info/6b429c8e-ee5b-451a-883f-b6180ada9286). It's now referred to as the “Employment Insurance Machine Learning Workload”.

-----

The COVID 19 pandemic has triggered an unprecedented volume of Employment Insurance",,2023-06-28T22:42:32.368099,17:07.7,3,1,https://open.canada.ca/data/dataset/24d2cab2-6a0d-4234-9239-b6ce102ebabd/resource/8c0e7774-3532-48a7-8da9-e93076e3c26d/download/aia-results_second_assesment.json,https://open.canada.ca/data/en/dataset/24d2cab2-6a0d-4234-9239-b6ce102ebabd,machine learning
24d2cab2-6a0d-4234-9239-b6ce102ebabd,Reducing Employment Insurance Backlog: A Machine Learning Approach,Employment and Social Development Canada | Emploi et Développement social Canada,"UPDATE: 

In July 2023, the implementation of the Machine Learning model proved successful, resulting in the completion of over 40,000 claims.
Although this page won't receive further updates, the project is still ongoing and can be accessed [here](https://open.canada.ca/data/en/info/6b429c8e-ee5b-451a-883f-b6180ada9286). It's now referred to as the “Employment Insurance Machine Learning Workload”.

-----

The COVID 19 pandemic has triggered an unprecedented volume of Employment Insurance",,2023-06-28T22:42:32.368099,17:07.7,3,1,https://open.canada.ca/data/dataset/24d2cab2-6a0d-4234-9239-b6ce102ebabd/resource/8c0e7774-3532-48a7-8da9-e93076e3c26d/download/aia-results_second_assesment.json,https://open.canada.ca/data/en/dataset/24d2cab2-6a0d-4234-9239-b6ce102ebabd,ml
36868800-ca97-4dd8-8891-78ab54ee23bc,Assessment in Support of Changes to the Maximum Level for Arsenic in Fruit Juice and Fruit Nectar,Health Canada | Santé Canada,"Arsenic is naturally occurring in the environment, and very low levels are present in various foods. Elevated arsenic exposure from drinking water has been associated with a variety of serious adverse health effects, with potential effects noted in vulnerable populations such as infants and children.

Health Canada has conducted a scientific assessment, provided below, which supports updating the maximum level (ML) for total arsenic in fruit juice and fruit nectar. Health Canada is proposing t",,2022-08-17T15:21:18.538614,46:24.7,4,0,,https://open.canada.ca/data/en/dataset/36868800-ca97-4dd8-8891-78ab54ee23bc,ml
3b62274a-b926-4eea-9bee-9bb3a5bb2377,Assessment in Support of Risk Management for Arsenic in Rice-Based Foods Intended for Infants and Young Children,Health Canada | Santé Canada,"Arsenic is naturally occurring in the environment, and very low levels are present in various foods. Elevated arsenic exposure from drinking water has been associated with a variety of serious adverse health effects, with potential effects noted in vulnerable populations such as infants and children. 

Rice and rice-containing products are a major contributor to dietary exposure to inorganic arsenic in all ages, including infants and young children. In June 2020, Health Canada’s Food Directora",,2022-08-17T15:21:22.896471,46:22.8,4,0,,https://open.canada.ca/data/en/dataset/3b62274a-b926-4eea-9bee-9bb3a5bb2377,ml
afc17416-3781-422d-a4a9-cc55e3a053c8,Algorithmic Impact Assessment - ArriveCAN Proof of Vaccination Recognition,Public Health Agency of Canada | Agence de la santé publique du Canada,"Detailed results from the Algorithmic Impact Assessment (AIA) for the ArriveCAN Proof of Vaccination Recognition. ArriveCAN is a digital platform that is being used to collect travel and COVID-19-related health information from individuals traveling to Canada. By automating the scanning of travellers' proof of vaccination using Optical Character Recognition (OCR) technology, ArriveCAN augments the government's capacity to process incoming travellers and enhances its readiness to adapt to the gra",,2021-10-27T18:32:00.545076,27:57.9,3,1,https://open.canada.ca/data/dataset/afc17416-3781-422d-a4a9-cc55e3a053c8/resource/9a3dd6b0-3ea6-47ba-963b-87437b11280f/download/arrivecan-2021-10-06v11.json,https://open.canada.ca/data/en/dataset/afc17416-3781-422d-a4a9-cc55e3a053c8,ai
f30e2e77-6eb5-4bf3-89e8-d38f07c4886f,Access to Information User-Experience Survey,Treasury Board of Canada Secretariat | Secrétariat du Conseil du Trésor du Canada,"Between July–August 2021, a User Experience (UX) Survey was conducted to gather feedback on the process of submitting an Access to Information (ATI) request for government records.  
The survey was comprised of 4 sections, with a total of 32 questions , organized as follows:
1.	Submitting a request (Q1-Q11) 
2.	Contact with an ATIP Officer (Q12-Q18) 
3.	Proactive Publication (Q19-Q24) 
4.	Demographic information (Q25-Q31)
The questions and the distribution of responses can be found below. ",,2022-04-25T13:39:10.273893,04:54.8,6,4,https://open.canada.ca/data/dataset/f30e2e77-6eb5-4bf3-89e8-d38f07c4886f/resource/631753e0-5793-44d5-86d0-df594d7cc187/download/en-data-dictionary.csv | https://open.canada.ca/data/dataset/f30e2e77-6eb5-4bf3-89e8-d38f07c4886f/resource/b4779a4f-14a5-4846-a8c0-a60fe2cbc26b/download/en-open-dataset-v2.csv | https://open.canada.ca/data/dataset/f30e2e77-6eb5-4bf3-89e8-d38f07c4886f/resource/763f008a-b6a7-4029-81f3-847d371357f1/download/fr-data-dictionary.csv | https://open.canada.ca/data/dataset/f30e2e77-6eb5-4bf3-89e8-d38f07c4886f/resource/9661cf1e-d681-43a7-8ce2-126793511abc/download/copie-de-f-open-dataset-v2.csv,https://open.canada.ca/data/en/dataset/f30e2e77-6eb5-4bf3-89e8-d38f07c4886f,ai
9e278468-47d3-49c6-a2ed-1359e926c926,Chief Information Officer's Speaking Points - Big Data & Analytics Canada 2020 Summit,Shared Services Canada | Services partagés Canada,"The speaking points for Shared Services Canada's Chief Information Officer at the Big Data and Analytics Canada Summit that took place February 13th, 2020. ",,2020-08-28T13:00:36.858505,10:23.9,2,0,,https://open.canada.ca/data/en/dataset/9e278468-47d3-49c6-a2ed-1359e926c926,data analytics
21f85dbe-397b-4904-a878-fcc06c8118e3,Reaching forward to a better future 2023–2024 annual report,Standards Council of Canada | Conseil canadien des normes,"Explore SCC’s 2023–2024 annual report

Standardization is vital to Canada’s future. It gives us a way to tackle some of the biggest challenges facing not only our country but society as a whole, bringing together many different perspectives to arrive at a consensus on the best way to move forward.

In 2023–2024, we focused on issues relating to digital technologies and artificial intelligence (AI), international trade and supply chain resilience, climate change mitigation and adaptation, and",,2024-10-09T20:30:28.896174,33:21.5,2,0,,https://open.canada.ca/data/en/dataset/21f85dbe-397b-4904-a878-fcc06c8118e3,ai
5c3ae63a-9f96-41eb-a7d6-b4929532ca75,"THE SEAWAY INTERNATIONAL BRIDGE CORPORATION, LTD 2023-2024 ANNUAL REPORT TO PARLIAMENT ON THE ACCESS TO INFORMATION ACT","The Seaway International Bridge Corporation | Corporation du pont international de la voie maritime, Ltée","THE SEAWAY INTERNATIONAL BRIDGE CORPORATION, LTD 2023-2024 ANNUAL REPORT TO PARLIAMENT ON THE ACCESS TO INFORMATION ACT",,2024-10-08T19:10:30.930599,33:04.0,2,0,,https://open.canada.ca/data/en/dataset/5c3ae63a-9f96-41eb-a7d6-b4929532ca75,ai
01edade5-4a84-4548-b4a4-f3614a27a3f4,THE FEDERAL BRIDGE CORPORATION LIMITED 2023-24 ANNUAL REPORT TO PARLIAMENT ON THE ACCESS TO INFORMATION ACT,Federal Bridge Corporation | Société des ponts fédéraux,FBCL 2023-2024 Annual Report on the Access to Information Act,,2024-10-08T18:50:35.703100,33:03.3,2,0,,https://open.canada.ca/data/en/dataset/01edade5-4a84-4548-b4a4-f3614a27a3f4,ai
b0a4b1f7-9ccf-4716-841e-4ba3d1f92d21,Annual Report on ATI,Office of the Commissioner of Official Languages | Commissariat aux langues officielles,2022-2023 Office of the Commissioner of Official Languages annual report to parliament on access to information. ,,2023-09-28T20:51:47.542510,32:16.6,2,0,,https://open.canada.ca/data/en/dataset/b0a4b1f7-9ccf-4716-841e-4ba3d1f92d21,ai
74738ff5-5367-5958-9aee-98fffdcd1876,GeoAI - GeoBase Series,Natural Resources Canada | Ressources naturelles Canada,"GeoAI are buildings, hydrography, forests, and roads automatically extracted using Deep Learning models applied to a source dataset, typically aerial or satellite images. The primary aim of GeoAI is to increase Canada's availability of high-resolution foundational geospatial data for both spatial and temporal coverage.  
  
  ‌  
  
  The infrastructure and expertise put in place by NRCan enables a rapid, efficient, and scalable data creation process through the use of leading-edge technology an",,2023-10-30T12:20:29.413855,50:33.8,8,0,,https://open.canada.ca/data/en/dataset/74738ff5-5367-5958-9aee-98fffdcd1876,ai
d2b0509e-0e73-4380-954a-9f9febe0e975,"British Columbia – Ministry of Forests, Forest Ecosystems Research Network",Environment and Climate Change Canada | Environnement et Changement climatique Canada,"Network Title: British Columbia – Ministry of Forests, Forest Ecosystems Research Network

Domain: Weather

Network Type: Atmospheric: Surface

Network Provider: British Columbia Ministry of Forests

Network Provider Website: https://www2.gov.bc.ca/gov/content/governments/organizational-structure/ministries-organizations/ministries/forests

Station Automation: Automated

Highest Sampling Frequency: 1 Hour

Data Feed Frequency: Real time

Period of Operation (Seasonal or Continuou",,2024-11-12T19:50:34.713551,50:34.7,2,0,,https://open.canada.ca/data/en/dataset/d2b0509e-0e73-4380-954a-9f9febe0e975,ml
9179b74a-bad3-436a-aa33-ffc5018cc519,"British Columbia – Ministry of Forests, Fire Weather Network",Environment and Climate Change Canada | Environnement et Changement climatique Canada,"Network Title: British Columbia – Ministry of Forests, Fire Weather Network

Domain: Weather

Network Type: Atmospheric: Surface

Network Provider: British Columbia Ministry of Forests

Network Provider Website: https://www2.gov.bc.ca/gov/content/governments/organizational-structure/ministries-organizations/ministries/forests

Station Automation: Automated

Highest Sampling Frequency: Hourly

Data Feed Frequency: Real time

Period of Operation (Seasonal or Continuous): Continuous",,2024-11-12T19:50:33.050549,50:33.1,2,0,,https://open.canada.ca/data/en/dataset/9179b74a-bad3-436a-aa33-ffc5018cc519,ml
99c9c84a-0f0c-47e4-b87a-08b7a80684c6,"British Columbia – Capital Regional District, Meteorological Network",Environment and Climate Change Canada | Environnement et Changement climatique Canada,"Network Title: British Columbia – Capital Regional District, Meteorological Network

Domain: Weather

Network Type: Atmospheric: Surface

Network Provider: Capital Regional District

Network Provider Website: https://www.crd.bc.ca/

Station Automation: Automated

Highest Sampling Frequency: Hourly

Data Feed Frequency: Real time for 15 Atmospheric: Surface/Hydrometric stations. Manual data feed for 18 Hydrometric stations.

Period of Operation (Seasonal or Continuous): Continuous",,2024-11-12T18:40:23.677717,50:25.9,4,0,,https://open.canada.ca/data/en/dataset/99c9c84a-0f0c-47e4-b87a-08b7a80684c6,ml
40c5080e-da2f-4dd1-ab60-28dc2ff39e79,"Yukon – Department of Community Services, Fire Weather Network",Environment and Climate Change Canada | Environnement et Changement climatique Canada,"Network Title: Yukon – Department of Community Services, Fire Weather Network

Domain: Weather

Network Type: Atmospheric: Surface

Network Provider: Yukon Department of Community Services

Network Provider Website: https://yukon.ca/en/department-community-services

Station Automation: Automated

Highest Sampling Frequency: Hourly

Data Feed Frequency: Real time

Period of Operation (Seasonal or Continuous): Continuous

Number of Stations: 27

Category of Reported Elements: T",,2024-10-17T18:20:40.746989,40:23.4,2,0,,https://open.canada.ca/data/en/dataset/40c5080e-da2f-4dd1-ab60-28dc2ff39e79,ml
bcab4e7a-5cef-4304-af47-7fd131549ceb,Review on Official Languages (2022-2023),Department of Justice Canada | Ministère de la Justice Canada,"Information collected through this process is used by Canadian Heritage to prepare the Annual Report on Official Languages, the Best Practices 
Digests for Part VII and various other tools to support federal institutions with the implementation of 
Part VII of the OLA.",,2024-10-29T19:50:35.397829,50:35.4,4,0,,https://open.canada.ca/data/en/dataset/bcab4e7a-5cef-4304-af47-7fd131549ceb,ai
e0a36ea8-de0d-4f75-92fd-0f075577008a,"Saskatchewan – Saskatchewan Public Safety Agency, Fire Weather Network",Environment and Climate Change Canada | Environnement et Changement climatique Canada,"Network Title: Saskatchewan – Saskatchewan Public Safety Agency, Fire Weather Network

Domain: Weather

Network Type: Atmospheric: Surface

Network Provider: Saskatchewan Public Safety Agency

Network Provider Website: https://www.saskpublicsafety.ca/

Station Automation: Automated

Highest Sampling Frequency: Hourly

Data Feed Frequency: Real time

Period of Operation (Seasonal or Continuous): Continuous

Number of Stations:
75
Quick deploy stations (3 others)
Grassland Nat",,2024-10-18T17:19:00.818765,19:00.8,3,0,,https://open.canada.ca/data/en/dataset/e0a36ea8-de0d-4f75-92fd-0f075577008a,ml
52a9cf83-69ea-45bd-9aee-0b88295612db,"Newfoundland and Labrador – Vale Canada | Department of Environment and Climate Change, Water Resources Network",Environment and Climate Change Canada | Environnement et Changement climatique Canada,"Network Title: Newfoundland and Labrador – Vale Canada | Department of Environment and Climate Change, Water Resources Network

Domain: Weather

Network Type: Atmospheric: Surface

Network Provider: Vale Canada Ltd. | Newfoundland and Labrador Department of Environment and Climate Change

Network Provider Website: https://vale.com/canada

Station Automation: Automated

Highest Sampling Frequency: Hourly

Data Feed Frequency: Real time

Period of Operation (Seasonal or Continuous)",,2024-10-18T17:18:59.752427,18:59.8,2,0,,https://open.canada.ca/data/en/dataset/52a9cf83-69ea-45bd-9aee-0b88295612db,ml
b0e72152-6240-4608-9e84-88ee778df811,"Number of people who participated in a French course offered by MIFI, by fiscal year",Government and Municipalities of Québec | Gouvernement et municipalités du Québec,"The dataset presents a table that provides information on the number of people who participated in a French course offered by the MIFI, by fiscal year (2016-2017 to 2023-2024).",,2022-12-14T15:02:39.090072,01:13.4,3,1,https://www.donneesquebec.ca/recherche/dataset/b0e72152-6240-4608-9e84-88ee778df811/resource/1294beee-a63a-4bc8-9b36-10a3ee09593b/download/nombre-personnes-participe-cours-francais-mifi_final.csv,https://open.canada.ca/data/en/dataset/b0e72152-6240-4608-9e84-88ee778df811,ai
